{
  "schema": "personal-agent/evidence-record/v1",
  "id": "FND-0006",
  "type": "FND",
  "title": "Existence checks cannot catch relevance errors",
  "status": "accepted",
  "summary": "Cheap-model over-claims cite files and symbols that really exist but do not implement the item (for example citing a generic telemetry module as partial evidence for an OpenTelemetry projection). Verifying existence at the pinned base removed almost nothing. Relevance needs either an objective task definition or a judge; a deterministic check is only useful where the claim itself is mechanically checkable.",
  "links": [
    {
      "rel": "derived_from",
      "ref": "EXP-0001"
    },
    {
      "rel": "relates_to",
      "ref": "FND-0001"
    }
  ],
  "provenance": {
    "session": "ORCH-0002 -> ORCH-0003 (EXP-0001)",
    "author_tier": "frontier (Opus 5.5) analysis of deterministic eval output"
  },
  "created_at": "2026-09-29T02:40:00+00:00",
  "updated_at": "2026-09-29T02:40:00+00:00"
}
