{
  "schema": "personal-agent/evidence-record/v1",
  "id": "EVR-0012",
  "type": "EVR",
  "title": "EVS-ROUTING: e259ab74 vs HEAD",
  "status": "accepted",
  "outcome": "noninferior",
  "summary": "`agent-os orchestrate eval` (tests suite). Quality verdict per candidate uses pass rate + new failing tests; cost and latency are reported separately. Noninferiority margin 0.02.",
  "task_family": "routing",
  "metrics": {
    "kind": "tests",
    "incumbent": "e259ab74",
    "noninferiority_margin": 0.02,
    "results": [
      {
        "ref": "e259ab74",
        "commit": "e259ab7486dc",
        "seconds": 102.63,
        "tests_run": 78,
        "passed": 78,
        "failures": 0,
        "errors": 0,
        "skipped": 0,
        "pass_rate": 1.0,
        "failing": []
      },
      {
        "ref": "HEAD",
        "commit": "aabff0eab7d2",
        "seconds": 101.96,
        "tests_run": 78,
        "passed": 78,
        "failures": 0,
        "errors": 0,
        "skipped": 0,
        "pass_rate": 1.0,
        "failing": []
      }
    ],
    "comparisons": {
      "HEAD": {
        "verdict": "noninferior",
        "dimensions": {
          "pass_rate": {
            "incumbent": 1.0,
            "candidate": 1.0,
            "delta": 0.0,
            "verdict": "noninferior"
          },
          "failures": {
            "incumbent": 0,
            "candidate": 0,
            "delta": 0,
            "verdict": "noninferior"
          },
          "errors": {
            "incumbent": 0,
            "candidate": 0,
            "delta": 0,
            "verdict": "noninferior"
          },
          "tests_run": {
            "incumbent": 78,
            "candidate": 78,
            "delta": 0,
            "verdict": null
          },
          "seconds": {
            "incumbent": 102.63,
            "candidate": 101.96,
            "delta": -0.67,
            "verdict": "noninferior"
          },
          "new_failing_tests": {
            "candidate": [],
            "verdict": "noninferior"
          }
        }
      }
    },
    "notes": []
  },
  "links": [
    {
      "rel": "measures",
      "ref": "projects/personal-agent-os/orchestrator-os/evals/suites/EVS-ROUTING.json"
    },
    {
      "rel": "baseline",
      "ref": "commit:e259ab7486dc"
    },
    {
      "rel": "candidate",
      "ref": "commit:aabff0eab7d2"
    },
    {
      "rel": "tests",
      "ref": "IMP-0005"
    }
  ],
  "provenance": {
    "source": "agent-os orchestrate eval",
    "suite_read_from": "trusted checkout",
    "trusted_commit": "aabff0ea"
  },
  "created_at": "2026-09-29T04:12:54.015207+00:00",
  "updated_at": "2026-09-29T04:12:54.015207+00:00"
}
