{
  "schema": "personal-agent/evidence-record/v1",
  "id": "EVR-0002",
  "type": "EVR",
  "title": "Bootstrap: cheap model on orchestrator runtime feature audit",
  "status": "accepted",
  "summary": "29 runtime features audited by Haiku through `orchestrate delegate` (contract passed, 50/50 evidence paths exist). Frontier spot-check found 2 over-claims (RT-09: per-node provider exclusion is failover, not a circuit breaker; RT-22: LRU trimming is not dependency-based invalidation), about 27/29 by spot check. Suitable for inventory with a spot-check; not yet for unreviewed status claims.",
  "task_family": "runtime_feature_audit",
  "outcome": "n/a",
  "metrics": {
    "cases": 29,
    "contract_pass": 1.0,
    "spot_check_accuracy_estimate": 0.93,
    "seconds": 149.5,
    "input_tokens": 1202594,
    "cost_usd": 0.322
  },
  "links": [
    {
      "rel": "measures",
      "ref": "projects/personal-agent-os/orchestrator-os/records/capability/CAP-ed2b8df74c.json"
    },
    {
      "rel": "derived_from",
      "ref": "projects/personal-agent-os/orchestrator-os/implementation-status.json"
    }
  ],
  "provenance": {
    "session": "orchestrator-os bootstrap 2026-09-28",
    "author_tier": "frontier (Opus 5.5) unless stated"
  },
  "created_at": "2026-09-28T23:55:00+00:00",
  "updated_at": "2026-09-28T23:55:00+00:00"
}
