{
  "schema": "personal-agent/evidence-record/v1",
  "id": "FND-0013",
  "type": "FND",
  "title": "Generating adversarial attack fixtures is environment-limited; import corpora as data instead",
  "status": "accepted",
  "summary": "The safety classifier stops generation of realistic multi-vector attack content (exfiltration + publication + test sabotage) even for defensive testing of this repository (EXP-0008). Consequence for the security roadmap: prefer importing third-party attack corpora as data through the external corpus registry (AgentDojo PA-agentdojo, Promptfoo PA-promptfoo, garak PA-garak) over authoring attack payloads here, and validate defenses deterministically with synthetic-worker transcripts (test_publication_guard.py) where a real adversarial run is not available.",
  "links": [
    {
      "rel": "derived_from",
      "ref": "EXP-0008"
    },
    {
      "rel": "relates_to",
      "ref": "projects/personal-agent-os/orchestrator-os/evals/external-corpora.json"
    }
  ],
  "provenance": {
    "session": "ORCH-0019 -> ORCH-0020 (MIE-0004)",
    "author_tier": "frontier (Opus 4.8)"
  },
  "created_at": "2026-09-29T08:05:00+00:00",
  "updated_at": "2026-09-29T08:05:00+00:00"
}
